Category,Description
Data Scientist,looking experienced data span classhighlightengineeringspan expert assist us securing intermediatelevel job data span classhighlightengineeringspan field focus azure ideal candidate proven expertise azure data span classhighlightengineeringspan tools data pipelines sql etl processes guide us optimizing resume improving skill set preparing interviews land job field key responsibilities job application strategy help identify relevant job opportunities intermediatelevel data span classhighlightengineerspan assist tailoring resume cover letter match job descriptions skill enhancement provide guidance advancing skills key azure data span classhighlightengineeringspan tools like azure data factory databricks azure synapse analytics well sql etl processes interview preparation conduct mock interviews focus intermediatelevel data span classhighlightengineeringspan concepts scenarios providing actionable feedback portfolio development assist building strong portfolio includes relevant projects case studies work samples showcase expertise azurebased data span classhighlightengineeringspan job search guidance offer advice finding applying suitable roles optimizing linkedin profiles networking strategies required skills qualifications proven experience data span classhighlightengineeringspan roles practical experience building managing data pipelines using azure tools expertise azure tools services including azure data factory databricks azure synapse analytics azure sql span classhighlightdatabasespan strong proficiency sql including complex queries joins subqueries aggregate functions solid understanding etl processes data integration data warehousing techniques familiarity python pyspark data processing manipulation strong communication skills ability guide mentor someone seeking break intermediatelevel data span classhighlightengineeringspan role experience preparing job interviews optimizing resumes data span classhighlightengineeringspan positions nice experience data modeling data visualization machine learning concepts familiarity devops docker cicd pipelines context data span classhighlightengineeringspan experience azure devops azure management tools apply please provide resume brief description expertise help us land intermediatelevel job data span classhighlightengineeringspan field focus azure include relevant experience mentoring others guiding job seekers data span classhighlightengineeringspan field
Data Scientist,looking experienced full stack span classhighlightengineerspan tackle backlog development tasks flexibility focus cuttingedge technologies taskbased role offers chance contribute highimpact projects involving frontend backend cloud infrastructure machine learning responsibilities web application development build optimize web applications reactjs front end pythondjango back end scale secure span classhighlightdatabasesspan like sql server mysql postgresql azure sql amazon rds mongodb authentication payment systems implement secure user authentication protocols eg twofactor authentication integrate stripe seamless payment processing api machine learning integration develop manage robust api endpoints deploy machine learning models production environments cloud devops utilize platforms like azure aws gcp tools like dockerkubernetes containerization deployment implement monitoring observability systems frontend backend infrastructure chatbot features llms work chatbot functionalities leveraging tools like langchain llamaindex needed code quality documentation ensure consistency quality version control systems like github maintain clear thorough documentation team collaboration future maintenance first task troubleshoot resolve span classhighlightdatabasespan error related gis mapping qualifications experience years full stack span classhighlightengineerspan expertise pythondjango reactjs familiarity large span classhighlightdatabasesspan reducing latency scalability knowledge vector span classhighlightdatabasesspan scaling large language models llms technical skills span classhighlightdatabasespan management sql server postgresql etc stripe integration api development proficiency dockerkubernetes cloud platforms bonus skills experience chatbots llms like langchain llamaindex strong commitment clean detailed documentation
Data Scientist,looking team individual experts develop mvp minimum viable product predictive analytics platform generates monthly forecasts financial markets confidential project requiring selected candidates sign nda details disclosed project involves building robust backend data ingestion developing forecasting algorithms creating userfriendly dashboard display predictions insights system must modular scalable allow future enhancements integrations groundup development project seeking talented professionals experienced predictive analytics financial data processing web application development project overview mvp include data aggregation collect process historical realtime financial data apis store data structured secure span classhighlightdatabasespan modeling analysis forecasting module develop algorithms predict financial trends generate monthly projections implement confidence scoring system indicate reliability forecasts dashboard create intuitive webbased interface users view forecasts insights display data using interactive charts visualizations contextual insights integrate relevant market events data trends enhance forecasting output roles responsibilities data scientistmachine learning span classhighlightengineerspan design train forecasting models based financial data implement confidence scoring predictions skills python tensorflowpytorch timeseries forecasting feature span classhighlightengineeringspan backend developer build secure apis data ingestion model integration set cloudbased infrastructure data storage processing skills pythonnodejs awsgcp restful apis sqlnosql span classhighlightdatabasesspan frontend developer design responsive webbased dashboard display forecasts insights integrate backend apis dynamic data presentation skills reactjsvuejs htmlcss javascript chartjsdjs optional project manager recommended larger teams oversee project timelines deliverables team coordination tools jira trello slack key deliverables data pipeline apis span classhighlightdatabasespan secure data ingestion processing forecasting engine functional model generating monthly financial projections confidence scores frontend dashboard userfriendly interface interactive data visualization documentation comprehensive guides setup usage future development required experience proven expertise predictive analytics financial data platforms familiarity financial apis large datasets ability work nda maintain confidentiality strong communication skills collaborative mindset project timeline estimated duration weeks start date preferred date deliverables deadline preferred deadline budget estimated total budget depending experience scope open hiring individuals team preferred experience past work predictive analytics financial modeling projects familiarity integrating thirdparty apis data ingestion experience building dashboards interactive visualizations apply please include following application overview experience analytics financial platforms examples past projects portfolios generalized nda availability estimated timeline completing project hourly rate fixed price deliverables applying team specify roles covered team member individual rates
Data Scientist,title ai infrastructure setup automation integration security expert needed description seeking highly skilled devops span classhighlightengineerspan set deliver modular scalable ai infrastructure digitalocean project includes postgresql span classhighlightdatabasespan integration data organization management keycloak setup centralized security user access control autogpt deployment enable future automation capabilities ideal candidate proven expertise cloud infrastructure digitalocean aws span classhighlightdatabasespan management systems postgresql ai tools automation frameworks autogpt security integration keycloak similar tools requirements full autonomy build infrastructure ensuring modular easy maintain documentation provide clear documentation system setup usage future scaling collaboration communicate progress clearly deliver results within tight timeline scope medium expert level focus functionality first ability scale location preferences worldwide budget
Data Scientist,building tasktalentai aipowered saas platform helps cleaning businesses streamline hiring process using aidriven tools looking skilled fullstack javascript developer experience reactjs frontend nodejsexpressjs backend join team bring platform life project scope youll responsible building key components saas mvp frontend build responsive dynamic userfriendly interfaces using reactjs nextjs use frameworks like tailwind css bootstrap clean modern ui design connect frontend backend apis seamlessly backend develop restful apis using nodejs expressjs integrate thirdparty services eg stripe payments pinecone vector memory openai apis ai integration set authentication systems eg firebase memberstack integration work external toolsapis including scheduling tools calendly video processing tools ziggeo messaging tools twilio sendgrid key responsibilities build deploy frontend backend components mvp collaborate ai span classhighlightengineerspan integrate ai functionalities ensure application scalable secure performs efficiently troubleshoot fix bugs quickly maintaining clean maintainable code requirements proficiency reactjs nextjs frontend development strong experience nodejs expressjs backend development familiarity integrating thirdparty apis tools experience working span classhighlightdatabasesspan like mongodb postgres understanding version control systems eg git previous experience deploying applications vercel netlify platforms strong communication skills ability work independently bonus skills familiarity typescript experience stripe api firebase authentication knowledge seo optimization web applications deliverables fully functional frontend interfaces backend services integrate seamlessly platforms ai tools apis tested documented ready use code hosted github repository clear setup instructions deployed application vercelnetlify frontend herokuother backend hosting platforms project duration months mvp development hours fulltime hoursweek apply share examples previous work using reactjs nodejs include experience integrating thirdparty apis tools briefly explain youd approach developing dynamic job creation page frontend backend integration
Data Scientist,need recreate logo shown image vector using adobe illustrator logo features text nt positioned center circle gradient color scheme logo match style tone gradient shown image key requirements vector span classhighlightdesignspan logo must redrawn vector scalability precision gradient colors ensure logo uses gradient color scheme identical inspired image adobe illustrator final file provided adobe illustrator ai format high accuracy maintain close attention detail replicate span classhighlightdesignspan accurately please provide finished work editable ai format export highresolution png
Data Scientist,seeking talented creative thumbnail span classhighlightdesignerspan strong portfolio create eyecatching thumbnails youtube channel health niche ideal candidate understand importance high clickthrough rates ctr experience span classhighlightdesigningspan thumbnails attract viewers proficient graphic span classhighlightdesignspan tools able deliver highquality work consistent basis passionate visual storytelling create engaging thumbnails reflect brand want hear thumbnail span classhighlightdesignerspan able following knowledge health anti aging speak fluent english communicate effectively creative humorous must knowledge youtube videos rules regulations youve previously span classhighlightdesignedspan cash cow youtube thumbnail health genre please share samples work please send random samples niche
Data Scientist,already established wix website need help final finishing touches example adding names new teachers interns adding new events bulletin home page working wix service page also important require someone proficient wix handle changes updates position open hire like work done span classhighlightdesignerspan
Data Scientist,seeking talented freelance web developer graphic span classhighlightdesignerspan create engaging websites unique logos diverse clients ideal candidate keen eye span classhighlightdesignspan strong technical skills ability deliver highquality work within deadlines responsibilities include collaborating clients understand vision span classhighlightdesigningspan visually appealing userfriendly interfaces ensuring span classhighlightdesignsspan meet industry standards passionate web development graphic span classhighlightdesignspan would love see portfolio
Data Scientist,looking talented graphic span classhighlightdesignerspan create single image ad creatives upcoming campaign promoting ai trip planner feature travel app ads featured one week meta facebookinstagram linkedin platforms focusing driving app installs scope work deliverables single image ads meta linkedin image size requirements meta x px feed x px stories linkedin x px creative focus highlight lokalee apps trip planner tool using mix app ui mockups travel imagery text overlay professional aspirational span classhighlightdesignsspan appealing travel enthusiasts ad style creative clean modern span classhighlightdesignspan brandaligned seen lokaleeapp website social media accounts visit linkedin instagram profiles inspiration qualifications proven experience graphic span classhighlightdesignspan digital ads proficiency adobe photoshop illustrator similar tools strong understanding span classhighlightdesignspan principles social media ads portfolio showcasing previous social media ad span classhighlightdesignsspan preferably travel hospitality tech note posts brand guidelines provided project approval communication must available updates feedback project timeline longterm opportunity exceptional work may lead continued monthly collaborations deadline deliver final tweaked span classhighlightdesignsspan x ad creatives within days project start max dec speed highquality output key
Data Scientist,reaching im looking skilled graphic span classhighlightdesignerspan work creating original logos based existing references brand concept urgent ask wed need work completed next days please reach project take would love chat asap today
Data Scientist,hiring creative graphic span classhighlightdesignerspan talented graphic span classhighlightdesignerspan passionate creating span classhighlightdesignsspan grab attention join social media agency work exciting projects including social media post span classhighlightdesignspan logo creation packaging span classhighlightdesignspan looking creative professional span classhighlightdesignsspan stand strong understanding branding attention detail experience span classhighlightdesignspan tools like adobe photoshop illustrator apply send portfolio showcasing brandingsocial media posts logos packaging work include pricing per social media post per logo span classhighlightdesignspan per packaging span classhighlightdesignspan youre ready showcase talent apply
Data Scientist,seeking experienced webflow tutor assist building simple portfolio website video call sessions engagement anticipated require hours total candidates must fluent least one following languages english farsi italian strong expertise webflow prior tutoring experience essential webflow expert passion teaching would love connect hear help
Data Scientist,looking skilled creative video editor help bring faceless youtube channel life channel focuses philosophy personal growth timeless wisdom presented modern engaging way flair storytelling eye cinematic visuals ability integrate movie scenes broll animations seamlessly wed love work responsibilities edit minute youtube videos ensuring highquality output smooth pacing transitions incorporate cinematic broll stock footage movie scenes enhance storytelling sync video prerecorded voiceovers add engaging visual elements eg text overlays animations work collaboratively meet deadlines incorporate feedback maintain consistency style open creative experimentation requirements proficiency video editing software eg adobe premiere pro final cut pro davinci resolve experience editing youtubestyle content preferably niches like personal growth education storytelling ability source integrate licensed stock footage movie clips creatively legally familiarity royaltyfree music sound span classhighlightdesignspan enhance video impact strong storytelling skills attention detail preferred required experience motion graphics creating custom animations knowledge copyright fair use guidelines movie scenes provide scripts suggested visual cues clear deadlines expectations expect highquality editing elevates contents storytelling engagement creativity incorporating visuals align scripts themes flexibility openness feedback initial trial phase budget per video depending experience quality longterm work potential increased rates channel grows please include following application portfolio examples previous work links youtube videos preferred
Data Scientist,im looking span classhighlightdesignerspan keen eye color style take prepurchased templates creative market transform something polished elevated visually striking using canva span classhighlightdesignspan platform client personal training fitness studio need someone work magic brand colors enhance templates span classhighlightdesignerspan values simplicity knows make span classhighlightdesignspan look stylish premium ability give local businesses polished bigbrand feel instagram templates important notes work must done canvano platforms small businesses large corporations goal make look elevated professional must modern stylish aestheticbasic span classhighlightdesignspan wont cut youre color wizard sharp sense style experience creating igworthy span classhighlightdesignsspan id love see portfolio lets collaborate bring templates life
Data Scientist,want write data quality rules aws glue job evaluating csv file conditions attached images column names data type condition evaluated output written output data quality folder code argument pass file location file path
Data Scientist,job title l aws cloud database support job location mumbai vikhroli job type onsite months job summary seeking experienced l aws cloud database support span classhighlightengineerspan join team role provide advanced technical support aws cloud infrastructure database systems ensuring high availability scalability performance cloudbased solutions responsible troubleshooting diagnosing resolving complex issues related aws services databases integrations collaborating crossfunctional teams ensuring customers cloud environments running smoothly key responsibilities provide thirdlevel technical support aws cloud services database technologies troubleshoot resolve complex issues related aws infrastructure services ec rds lambda etc database solutions postgresql manage monitor optimize cloudbased databases ensuring optimal performance security availability work closely customers diagnose issues provide root cause analysis implement solutions collaborate span classhighlightdevopsspan span classhighlightengineeringspan teams ensure seamless cloud deployments integrations lead participate incident management service restoration processes provide guidance support l l support teams document incidents service requests solutions ticketing system perform regular health checks audits aws cloud environments database systems stay updated latest aws features services best practices assist design implementation scalable secure highly available cloud architectures
Data Scientist,job description seeking highly skilled gitops specialist deep experience azure cloud support getactyv platform role involve managing automating deployment monitoring scaling cloud infrastructure focus continuous integration continuous deployment cicd pipelines across approximately repositories also responsible managing databases configuring application gateways ensuring platforms scalability reliability key responsibilities implement gitops practices across repositories ensuring smooth automated deployments manage azure databases configure application gateways optimized routing security set maintain cicd pipelines using azure span classhighlightdevopsspan ensuring fast secure automated deployments implement monitoring alerting logging solutions maintain high availability quick troubleshooting collaborate closely development span classhighlightdevopsspan teams improve deployment processes system performance required skills proven experience gitops practices tools especially within azure cloud environments strong expertise azure span classhighlightdevopsspan including cicd pipeline creation maintenance experience managing databases azure eg azure sql cosmosdb configuring application gateways proficiency infrastructure code iac tools like terraform bicep azure resource manager arm templates familiarity containerization orchestration eg docker kubernetes gitops context plus preferred qualification experience monitoring tools azure monitor prometheus grafana
Data Scientist,deploy issue pipeline gitlab see attached file need help asap ftp vps hosting ssh access litespeed
Data Scientist,im developing new saas solution offers scheduling analytics potential aidriven insights weve already completed core authentication basic functionality nextjs supabase payments workflows wont starting scratch need fullstack span classhighlightengineerspan take project implementing advanced features ensuring robust scalable architecture responsibilities feature development build scheduling functionality multilocation support staff calendars waiting lists etc integration customisation connect thirdparty services eg calendar tools gateways eventually enhance ai advanced analytics experience performance security ensure platform runs efficiently securely implementing best practices data handling rolebased access compliance scalability maintainability propose implement improvements existing code better performance future extensibility collaboration documentation work refine requirements document processes decisions code future development seamless requirements proficient nextjs supabase quickly understand existing codebase includes authentication foundational endpoints fullstack experience solid background frontend reactnextjs backend nodesqlorms api integrations familiar integrating external apis especially calendars payments stripe similar git cicd comfortable version control setting maintaining continuous integrationdeployment pipelines communication documentation able work remote collaboration environment provide clear updates write thorough documentation aiml knowledge experience aidriven analytics chatbot integrations bonus uiux skills also refine user interface collaborate design improvements thats plus plustohave span classhighlightdevopsspan expertise experience infrastructureascode containerization advanced cicd setups project foundation place existing nextjs supabase codebase ready youre starting scratch jump make impact right away engagement details scope initially focused building core features refining codebase integrating critical services potential expand new features good fit next steps share examples previous nextjs supabase projects ai based projects schedulingbookingfocused apps youve worked provide brief overview youd approach engagement best practices youd recommend
Data Scientist,experience andor certification azure data span classhighlightengineerspan azure developer azure span classhighlightdevopsspan span classhighlightengineerspan professional level nice etl data warehousing reporting experience experience coding azure context experience azure data factory experience azure data bricks experience azure span classhighlightdevopsspan pythonsql experience experience unittest pytest cicd experience
Data Scientist,upcoming projects need azurecertified specialists expertise designing implementing managing complex cloud environments qualify candidates must hold active certifications least one following az designing implementing microsoft azure networking solutions az administering windows server hybrid core infrastructure az designing microsoft azure infrastructure solutions az configuring operating microsoft azure virtual desktop
