Category,Description
Python Developer,essential experience python dash flask pytest sql oracle git understanding securityauthenticationauthorization deploying python microsoft environments docker kubernetes experience understanding regulatory requirements around data desired good azure cloud experience person profile appreciation understanding agile methodologies including knowledge tdd bdd experience working agile software development teams excellent communication skills
Python Developer,senior python developer backend hybrid remote location days home days nw london salary circa k k benefits senior python developer required revolutionary techfocused company challenging key role developing scalable highquality enterprisegrade products mentoring peers essential strong experience python backend development flask fastapi similar proven ability design build rest apis handson experience google cloud platform gcp
Python Developer,python developer greentech startup location london hybrid days salary k equity python developer django fastapi docker aws seeking highly skilled python developer background energy sector join dynamic start based london python developer team handson coding building brand new platform scratch position extraordinary opportunity experienced python developer looking advance
Python Developer,would like lead interesting projects intersection traditional finance blockchain experience least interest blockchain technology possibilities unlocks love working fast paced companies lots ownership collaboration learning weve partnered established financial technology firm provides professional services cryptocurrency blockchain web space established player sector wor
Python Developer,overview harnham working large retail business advertising space excited working subsidiary business supporting ai initiatives wider company company join exciting team operating start within large organisation giving chance wear multiple hats support strategic partner team role python engineer refactor api backend code implement best practices using fasta
Python Developer,comp pd contract months location remote first uk based stack python flask fastapi gcp bigquery longterm client wellknown consultancy delivering complete functional solutions support engineering teams ftse sp companies build complex digital strategies engineering excellence core approach half employees engineers building apis integrating external platf
Python Developer,python developer months london inside ir flexible hybrid objective global banking looking developer implement enhance portfolio optimisation model suite analytic tools support structuring execution lifecycle maintenance clients program strategic risksharing transactions srts existing model prototyped r inputs generated alteryx script core goal project encode production standard pytho
Python Developer,job description location united kingdom working period full time permanent office london hybrid studentcom studentcom worlds leading marketplace student accommodation services leader student marketplace technology innovator industry needed upgrade passionate helping students find perfect home supporting educational journey date weve helped students different countries founded
Python Developer,looking take python coding software engineering skills next level working ai focussed software solutions interested joining ambitious ai tech startup established learning software industry veterans years software engineering tech world challenging yet rewarding role company provides exceptional level flexibility around technology working practices would like hear fr
Python Developer,looking take python coding software engineering skills next level working business driven ai software solutions interested joining ambitious ai tech startup established ground level learning software industry veterans years software engineering tech world challenging yet rewarding role would like hear established clients stable revenue streams currently b
Python Developer,python developer glasgow consultancy client looking senior python developer join k benefits bonus days holiday paid certifications healthcare flexible hours much hybrid working says per week onsite glasgow python django linux sdlc client client midsize consultancy going strength strength work diverse range clients across financial services renewables healthcare role requ
Python Developer,seeking highly motivated senior python web developer react experience join fastpaced team individual responsible developing maintaining highperformance applications using python react ideal candidate strong technical background excellent problemsolving skills ability work fastpaced environment ensure services overall application robust tested easy maintain wil
Python Developer,seeking highly motivated senior python web developer react experience join fastpaced team individual responsible developing maintaining highperformance applications using python react ideal candidate strong technical background excellent problemsolving skills ability work fastpaced environment ensure services overall application robust tested easy maintain wil
Python Developer,landytech mission revolutionize way investment managers asset owners advisors access asset information powered sesame industryleading investment reporting platform helping clients countries make informed investment decisions deliver insights faster company growing rapidly exciting time join secured series b funding january four years gone two cofounders team
Python Developer,junior python developerquant analyst months london inside ir flexible hybrid objective global banking looking developer implement enhance portfolio optimisation model suite analytic tools support structuring execution lifecycle maintenance clients program strategic risksharing transactions srts existing model prototyped r inputs generated alteryx script core goal project encode prod
Python Developer,python developer back end software engineer sc clearance cor excellent opportunity experienced senior backend engineer strong python djangoflask skills join deep tech start developing nextgen aibased data processing tools role senior python developer senior backend engineer design develop maintain scalable back end systems using python djangoflask well creating managing restful apis openapiswagger specifica
Python Developer,fantastic opportunity work python developer major pharmaceutical company based cambridge outside ir python developer role require days per week site cambridge key skills required python developer role python aws sql relevant experience python developer role please apply
Python Developer,programming languages specialist r python focus job description client seeking talented passionate individual join global team programming language experts developers data scientists technical leads ideal ca
Python Developer,fantastic remote opportunity senior python developer living within reasonable commuting distance portsmouth hampshire seeking senior python developer strong flask experience join highly regarded software platform team exciting opportunity work cuttingedge projects dynamic environment focusing innovation scalability role primarily remote successful candidate occasionally visit portsmouth headquarters k
Python Developer,fantastic opportunity work highperformance systems bleedingedge tech environment highly profitable growing organisation role python developer core applications client looking core developer work building automated trade reconciliation system greenfield project work closely lead core developer cto middle office lead traders solution match order transfer information large
Python Developer,role recruiting behalf highly respected longshort hedge fund based london seeking experienced python developer expertise pandas broad highimpact role working alongside data engineering analytics teams support critical projects processes work closely highly skilled developer head risk manage data engineering tasks analytics workflows prior investment equities experience
Python Developer,python c systematic quant finance defi leading global quantitative investment firm seeking exceptional python developers quants revolutionize cryptocurrency trading infrastructure isnt typical finance tech role youll architecting ultraresponsive trading systems process complex algorithmic strategies across global markets running within techfirst buyside firm view developers central staff rather cost centre key highlights build
Python Developer,python developer glasgow consultancy client looking senior python developer join k benefits bonus days holiday paid certifications healthcare flexible hours much hybrid working says per week onsite glasgow python r linux sdlc client client midsize consultancy going strength strength work diverse range clients across financial services renewables healthcare role require
Python Developer,uk citizenship required position yes relocation assistance relocation assistance may available clearance type ukhighest level government clearance travel yes time define possible northrop grumman uk northrop grumman uk mission solve complex challenges shaping technology solutions tomorrow call defining possible mindset goes beyond customer solutions foundation career development
Python Developer,company description tutorcruncher comprehensive software platform tutoring companies offering features deliver optimal online learning experiences trusted leading names tutoring decade londonbased tech support teams dedicated showcasing platforms capabilities tutorcruncher helps tutoring businesses streamline operations manage invoicing payroll customize systems enhanced efficiency role description fulltime h
QA,redcentric qa analyst division cloud delivery development application services job location flexible uk based reports qa team lead redcentric redcentric leading managed service provider rich endtoend solution portfolio covering spectrum connectivity cloud collaboration designed delivered highly skilled teams privately owned uk based multimillion pound infrastructure redcentric annualised revenues excess
QA,new company recruiting experienced qa manager join growing pharmaceutical company based elstree exciting opportunity lead develop quality assurance team ensuring compliance gdp gmp regulations new role ideal candidate strong background quality assurance within pharmaceutical industry proven track record managing qms processes team leadership regulatory compliance youll need succ
QA,purpose role lead quality team ensure compliance internal external standards drive technical excellence agenda responsible development quality management system lead customer standard audits support operational teams issue resolution qualifications degree food safety technology another appropriate discipline haccp level experience taccp food authenticity adznuktj
QA,quality assurance lead chesterfield worksop hybrid flexible working benefits days holiday k car allowance matched pension annual target bonus individual private medical cover wrk digital delighted partner greencore leading manufacturer convenience food uk greencore supply major supermarkets uk well travel retail outlets discounters coffee shops foodservice providers retailers employing p
QA,ck group recruiting qa manager behalf one global human animal nutrition company lead establishment maintenance quality management system working iso fssc role based kent permanent role role key role includes responsibility monitoring advising performance quality management system producing data reporting performance whilst measuring set standards main
QA,job title quality engineer guidewire claims center location belfast salary company client global leader sector dedicated providing innovative cuttingedge solutions within insurance technology space known collaborative culture investment employee growth expanding belfast team due sustained growth ongoing success unique opportunity join team working highly technical niche
QA,exciting opportunity join qa team hardwick grange depot warrington depot qa administrator hours role monfri pm pm every sunday receive friday compensate overall purpose carry required administrative tasks around depot qa team product assessments associated actions taken issue comms around internal external stakeholders ensure suppliers trading teams
QA,digitalgenius venturebacked artificial intelligence ai company bringing practical applications deep learning ai largest customer service operations world fast growing companies growing team likeminded supportive people goal making customer service seamless experience team remote colleagues based uk us europe seeking highly skilled detailoriented qa engineer join product team
QA,seat unique dedicated helping fans get vip access best sports music cultural events proud premium ticketing marketplace working biggest prestigious clubs venues including welsh rugby union yorkshire cricket hampshire cricket york racecourse experts digital transformation provide clubs venues technology brings aspects hospitality booking process online improving customer expe
QA,qa engineer openlane make wholesale easy customers successful technology company building worlds advancedand uncomplicateddigital marketplace used vehicles data company helping customers buy sell smarter clear actionable insights understand use innovation company accelerating future wholesale remarketing curiosity collaboration entrepreneurial spirit openlane
QA,opportunity seeking passionate experienced quality assurance engineer quality assurance engineer within engineering discipline apply expertise test planning design development maintenance contributing ongoing growth qa capability within engineering discipline youll join talented team dynamic driven professional problem solvers creative thinkers solutions builders thrive helping clients meet mos
QA,senior lead qa engineer ready become part acclaimed startup situated heart cambridge lead mentor junior qa engineers company attracts brightest minds tech world currently seeking talented qa engineer strong academic credentials robust problemsolving skills keen attention detail join qa team ai software house already made significant mark industry positioned emerge next
QA,quality assurance manager responsible person based polar speed distribution limited site chartmoor road leighton buzzard lu wg hours monday friday hours per week salary per annum dependant experience polar speed reputation quality compliance operational customer facing technology monitoring solutions growing temperaturesensitive pharmaceutical logistics market uk company specialises active
QA,experienced qa engineer looking advance career mcs group thrilled partnering client help find skilled qa engineer join team role requirements experience qa engineer role familiarity test automation frameworks like playwright cypress selenium knowledge software development lifecycle testing practices passionate mentoring sharing expertise whats offer competitive salary benefits package e
QA,qa engineer outstanding opportunity experienced qa engineer join wellknown company northern ireland enters period significant growth role would ideal qa skilled manual testing api ui database years experience eager learn get experience automation packagebenefits k salary bonus hybrid working options flexible working hours candidates must based northern ireland able work hybrid belf
QA,mcs group thrilled partner uk plc search skilled junior software testers join team client involved highprofile government projects delivering processdriven software solutions across various sectors fantastic opportunity junior qas expand skill set working complex web applications role junior qa chance gain exposure new technologies part companys journey growth mode
QA,banbridge based client opportunity welding qa inspector join fabrication team quality welding inspector supervise production process guarantee products meet quality expectations escalate issues raised fabrication manager preforming quality stage inspections weld inspection well factory acceptance testing ensure quality stages recorded ensure full traceability prod
QA,hiring qa engineers k k manchester hybrid daysweek qa engineer skilled playwright passionate delivering highquality software weve partnered exclusively leading tech brand journey expansion across manchester great opportunity qa advocate part innovative environment quality forefront test design strategy skilled diverse testing techniques knack planning effective
QA,far tech companies go hard find established prolific name manchester tech scene client products arent optiontheyre standard cabinet full awards innovative software smefocused solutions theyve built reputation spans globe uk ireland canada new zealand australia theyre stopping kind reputation doesnt happen chance built quality thats
QA,qa scientist microbiology per hour paye base per hour including shift allowance worthing month contract gsk currently searching qa scientist microbiology join team worthing within role would responsible carrying microbiological analytical test methods nonsterile products including stability products required using sops accurately document results part quality control process ensure batch sa
QA,outstanding opportunity experienced qa engineer join wellknown company northern ireland enters period significant growth role would ideal qa skilled manual testing api ui database years experience eager learn get experience automation packagebenefits k salary bonus hybrid working options flexible working hours candidates must based northern ireland able work hybrid belfast unfortu
QA,quality assurance lead chesterfield worksop hybrid flexible working benefits days holiday k car allowance matched pension annual target bonus individual private medical cover wrk digital delighted partner greencore leading manufacturer convenience food uk greencore supply major supermarkets uk well travel retail outlets discounters coffee shops foodservice providers retailers employing p
QA,bits bits leading fintech startup focused promoting financial inclusion providing creditbuilding solutions mission empower individuals overlooked traditional lenders successfully supported customers across uk backed renowned investors driven innovation dedicated delivering highquality software products role seeking experienced qa engineer manager join team qa engin
QA,bits bits combinator backed credit card startup london team people profitable growing mission help people build credit serve usually looking buy home build credit become financially stable responsibilities qa analyst backend youd reporting qa team lead would responsible qa backend systems would work closely qa mobile analyst well need able write code
QA,bits bits combinator backed credit card startup london team people profitable growing mission help people build credit serve usually looking buy home build credit become financially stable responsibilities qa team lead youd reporting product head would also responsible managing qa analysts ultimately youre responsible getting stuff done really owning product qa requirements ye
QA,bits bits combinator backed credit card startup london team people profitable growing mission help people build credit serve usually looking buy home build credit become financially stable responsibilities qa analyst mobile youd reporting qa team lead would responsible qa ios android app mostly manual testing requirements years experience qa product engineering r
QA,qa engineer focused backend systems bits integral commitment quality reliability main responsibility ensure backend services function seamlessly consistently supporting frontend applications delivering exceptional user experience role encompass designing implementing executing test plans cover integration performance security aspects collaborate developers product teams
QA,manual qa tester play crucial role ensuring quality functionality web applications work closely development product teams identify document track defects ensuring applications meet highest standards quality user experience responsibilities review analyze system specifications requirements design develop execute comprehensive test plans test cases web applications perform thorou
QA,black tree gaming ltd owner nexusmodscom website user base million users serving billion pageviews year based heart southernhay exeter computer game loving collaborative team solving large scale challenges latest technology looking senior qa engineer join team exeter uk ideal candidate strong track record agile software development driving quality phases
QA,qa pharmacist band belfast kk vanrath delighted recruiting qa pharmacist band hscni based belfast role ongoing long term fantastic opportunity someone years experience pharmacy clinical qa looking work public sector please note offer sponsorship role salary k k enhanced holiday pay pension discount benefits responsibilities responsible management operation phar
QA,looking join leading food manufacturer one best clients looking qa compliance technologist join successful growing team amazing opportunity join forwardthinking manufacturer invest offer clear progression management role ideal candidate strong communication skills food safety knowledge previous experience working qa food manufacturing role k shropshire think
QA,manual qa engineer hybrid role daysweek uxbridge uk salary client technology company security solutions industry looking manual qa engineer join team uxbridge position focus testing advanced security solution ensuring durability performance hardware software components responsibilities endtoend testing cloudbased video security solution test new features improve test routines
QA,title head qa compliance location west yorkshire salary srg recruiting head qa compliance based rapidly growing pharmaceutical producer west yorkshire manufacturing numerous household brands found homes across country also produce specialist prescription products nhs position join quality leadership team reporting directly site quality head manage qa team oversee qms change quality
QA,client relentless mission harness power datadriven insights revolutionising products streamlining operations steering strategic choices continue remarkable trajectory growth innovation search accomplished forwardthinking qa engineer join mission becoming disruptor fintech space launched uk since achieved double unicorn status attracted million customers gen
QA,qaqc engineer london permanent passion quality instinct precision hunt qaqc engineer take key role shaping standards define mep contractors work role youll champion quality across every stage projects ensuring deliver isnt goodits exceptional quality core qaqc engineer youll instrumental embedding
QA,banbridge based client opportunity welding qa inspector join fabrication team quality welding inspector supervise production process guarantee products meet quality expectations escalate issues raised fabrication manager preforming quality stage inspections weld inspection well factory acceptance testing ensure quality stages recorded ensure full traceability pro
QA,qara specialist reporting emea qara manager role main functions maintain develop local quality pharmacovigilance management system support product registration local competent authorities undertake relevant training deputise responsible person rp manage various projects role responsibilities responsible regulatory compliance site according uk ireland regulations pharma medical device distribution
QA,looking dynamic experienced account director lead client acquisition expansion efforts youll work alongside industryleading experts quality assurance qa technology services driving new business nurturing key relationships delivering innovative solutions clients backed stability wellestablished company excitement rapid expansion role offers best worlds youll drive strategic sales develop
QA,job roleqa technician locationbased north norwich city centre hours hours mondaythursday friday salary permanent role based experience per annum holidayour holiday days take plus bank holidays add amount christmas shut vary specialist engineering client based north norwich city centre healthy growth plans looking recruit experience qa tec
QA,qa auditor days proud bakkavor full time permanent role salary days pm hours based near boston old leake pe pn highly competitive reward package including life insurance staff shop mybargains discount platform join us proud offer career global leader fresh prepared food industry proud give everyone opportunity support develop progress career nurture talent fuel
QA,bits seeking dedicated quality assurance qa engineer focus mobile applications ensure products meet highest quality standards role responsible designing implementing executing tests specifically mobile applications ensuring seamless user experience primary responsibilities include analyzing requirements developing test plans executing manual automated tests identifying issues across multiple mobile
QA,please note hiring qa engineer vacancy part office recruitment day thursday th july london office information sent applicants please apply youre happy based camden london office days week experience bits bits fastgrowing fintech startup dedicated promoting financial inclusion provide credit building solutions individuals overlooked main
QA,qa engineering placement timax based london n type fulltime month placement salary pa seeking motivated detailoriented qa engineering intern join product team internship offers unique opportunity gain handson experience software hardware testing audio products qa engineering intern work closely engineers ensure highest quality standards met across product range key responsibilities assis
