Category,Description
Data Scientist,locations uk europe africa uk london bae systems digital intelligence home digital cyber intelligence experts work collaboratively across countries collect connect understand complex data governments nation states armed forces commercial businesses unlock digital advantage demanding environments job title data scientist requisition id location london offer range hybrid flexible working arrangements
Data Scientist,head data science london days week office per annum share options exciting opportunity arisen fastgrowing fintech business based london looking handson data science leader take charge technical data science initiatives strong focus credit risk machine learning model development role ideal someone enjoys solving complex problems driving technical excellence traditional management r
Data Scientist,senior data scientist human motion tracking pose analysis location london uk hybrid days week onsite type fulltime perm able offer sponsorship stage company join pioneering venturebacked startup revolutionising health industry cuttingedge ai computer vision technologies stellar founding team successful first financial year company gained notable exposure acclaim major media industry showc
Data Scientist,join industry leader technology data scientist expertise pivotal transforming experience users worldwide client prides innovation seeking first senior data scientist push boundaries cuttingedge technology role presents exciting opportunity passionate technology future role responsibilities data scientist play crucial role advancing clients revoluti
Data Scientist,senior data scientist salary depending experience permanent hybrid london saga embarking data transformation journey across established business units cruise insurance travel financial services saga magazine keen make one hire growing team joining high performing inhouse data science working one senior data scientist saga play pivotal role shaping data strate
Data Scientist,looking seniordata scientist experience delivering managing data science models commercial setting join us month fixed term contract data one five strategic pillars n brown already plays really important part key decisions across organisation centralised highly visible giving us scope influence opportunities wherever team use modern cloud technologies build awardwinning data science solutions rewar
Data Scientist,currently seeking experienced data analyst join informatics team lead advanced analyses methodological data inform study design decisions informatics team utilizes informatics principles techniques architect mine analyze visualize clinical trial data inform study design choices pharmaceutical development informaticist create predictive data models identify analyze patterns program compelling visualizations
Data Scientist,role summary responsibilities responsible leveraging machine learning natural language processing expertise within healthcare sector support data science initiatives expand service offerings manage build databases support realworld evidence projects using electronic medical records data visualisation salary per annum depending previous experience benefits discretionary profit share bonuses hybrid working options
Data Scientist,builderai mission make app building easy everyone regardless background tech knowledge budget weve already helped thousands entrepreneurs small businesses global brands like nbc universal pepsi well american organizations like bobcat smart path achieve software goals weve started builderai voted one innovative companies ai fast company europas scaleup
Data Scientist,hiring data scientists want get weeds electricity system optimize usage renewables net zero grid future electricity grid changing beyond recognition without deploying new software orchestrate well unable decarbonise axle building infrastructure thatll underpin decarbonised energy system software crushes co energy costs goal insanely ambitious building team matc
Data Scientist,data scientist salary someone enjoys problem solving curious data insight gained typically role highly numerate mathematical science data background keen develop skills become expert data scientist enjoy working part team good communication interpersonal skills bit job exciting opportunity arisen
Data Scientist,looking exciting opportunity playing instrumental role success governments priority growth programmes wed love hear team growth delivery unit new team established drive delivery chancellors priorities support leadership growth mission governments ambition grow uk economy combining policy analytical project management data science skills monitor progress policies
Data Scientist,role involves working public sector client staff design implement maintain document data products models reports dashboards using modern tools techniques key aims work provide high quality well documented automatically updated data products use client sib staff showcase benefits data science cuttingedge approaches data challenges ensure client organisation take ownership data produc
Data Scientist,external description reach beyond liberty youll find super challenges youll given scope support go dig deeper fly higher wont stand shoulder wont get way certainly wont hold back youll bring expertise well provide platform succeed ready time thing youll working liberty data science group partner directly business stakeholders
Data Scientist,senior data scientist needed ai startup want work genuine greenfield projects want use skills aid education want work like minded individuals latest technologies role youll play pivotal role leveraging data drive strategic sights develop innovative solutions multiple high end educational institutions ideal data scientists thrive startup environment client soon become household name across
Data Scientist,data scientist hybrid days month southampton working leading company retail space looking use data science machine learning better understand customer base role work alongside pre existing data analytics team spearhead previously untouched project area report data science manager area ensure project delivery criteria met utilise companys customer data better understand
Data Scientist,join mission decarbonise grid data scientist heart mind talent proud partner rapidly growing startup thats building future energy grid mission optimise renewable energy usage reduce co emissions make electricity greener affordable everyone energy system transforms faster ever innovative software solutions critical achieving netzero emissions cuttingedge platform uses machine learning shift en
Data Scientist,job title data scientist location widnes originally onsite move hybrid arrangement salary yoh partnered rapidly scaling business pioneering leading datadriven technologies business approach using sensor signal detection work coming cliental within water oil gas industry since completed another round funding signed several large projects help support product roadma
Data Scientist,data scientist london decarbonize grid passionate positive impact society data science influence decarbonization grid data scientist join fastgrowing greentech startup building critical infrastructure accelerate transition netzero underpin decarbonized energy system backed top vcs angel investors previously invested meta bereal slack build greenfield
Data Scientist,senior data scientist ai engineer national security consultancy cheltenham london manchester bonus dv clearance required meritus working global tech consultancy looking experienced data scientist ai engineer join national security consulting team working uk national security customers exciting opportunity design deliver aidriven projects address realworld business challenges across various industries
Data Scientist,climatetech looking make real impact join forwardthinking startup tackling decarbonization accelerating electrification hiring data scientists help shape future energy innovation location london hybrid days per week inoffice mission decarbonise grid advance netzero solutions join work tightknit team engineersscientists business ops collaborating visionary cofounders backed funding offering exci
Data Scientist,preferable yoe salary range depending experience company description smart spaces awardwinning industryleading whitelabel iot platform providing allinone solution building management systems control communication platform smartenables workplaces adding efficiency daily work life occupiers employees property owners managers iot application helps manage everything building granting access system controls e
Data Scientist,senior lead data scientist client uks newest credit card provider deliver range fair flexible easy use financial services products uk consumers help people make smarter decisions money get life joining start journey creates unique opportunity significant impact influence foundational decisions whilst creating opportunity grow career alongside growth compan
Data Scientist,looking exciting opportunity playing instrumental role success governments priority growth programmes wed love hear team growth delivery unit new team established drive delivery chancellors priorities support leadership growth mission governments ambition grow uk economy combining policy analytical project management data science skills monitor progress policies
Data Scientist,seeking passionate data scientist lead endtoend implementation design data science applications various clients join growing practice play leading role ongoing development data science discipline driving innovation best practice adoption motivating empowering domain practitioners create positive creative culture people perform well learn grow youll join talented team dynamic driven professi
Data Scientist,complexio foundational ai works automate business activities ingesting whole company data structured unstructured making sense using proprietary models algorithms complexio forms deep understanding humans interacting using automation replicate improve actions independently complexio joint venture hafnia simbolo partnership marfin management c transport maritime trans sea transport b
Data Scientist,assala energy dynamic oil gas exploration production company committed sustainable development assets gabon value collaborative approach promote diversity prioritize safety integrity operations support creation development datadriven initiatives facilitate transition business processes toward datadriven methodology work following main deliverables provide services developing predictive
Data Scientist,principal data scientist salary aviva exciting opportunity principal data scientist work great team leading delivery innovative data science solutions protection business insurance wealth retirement iwr avivas biggest business unit largest life insurer uk holding shareof uk market role supports protection business number uk market delivering solutions across pricing trading
Data Scientist,principal data scientist london salary national salary aviva looking dynamic principal data scientist support global corporate speciality gcs team insurance industry evolving age rapid technological development organisation aviva investing strengthening machine learning analytics distinctive capability team joining recognised centre excellence global data science de
Data Scientist,data science manager salary circa national circa london passion turning data actionable insights driving strategic decisions problem solver loves solving business problems using data technology bit job data analytics manager lead datadriven initiatives help uncover risks internal audit function analyse complex datasets build predictive models create visual insights using visu
Data Scientist,job title lead data scientist ml ai projects salary location bristol hybrod working unfortunately sponsorship available client full uk working rights required client seeking recruit new lead data scientist lead data science initiatives drive innovation healthcare industry youll opportunity leverage expertise data analysis machine learning within dynamic forwardthinking team shape future hea
Data Scientist,new permanent opportunity dv cleared data scientist cheltenham leading national security defence consultancy client must active dv clearance k doe plus bonuses benefits days site per week cheltenham skills required machine learning awsazure python nlp ai recruiting data scientist dv clearance prestigious client work portfolio public private sector projects client global leader techn
Data Scientist,job title data scientist location shoreditch hybrid days per week onsite duration months contract max budget k k per annum paid holidays pension per day inside ir opportunity looking seasoned passionate data scientist individual contributor drive rapid growing uk express business hybrid role data science data engineering role use data science data engineering skill generate acti
Data Scientist,data scientistdata science analyst private equityinvestment hybrid days week central london office benefits company working market leading private equityinvestment firm bring new data scientist team second hire team plenty room make impact great opportunity data scientist couple years industry experience looking change role closely work team
Data Scientist,data scientist dm info im working leading tech company london thats forefront data science innovation theyre seeking talented data scientist join dynamic team exciting opportunity work cuttingedge projects hybrid work environment job responsibilities develop implement advanced machine learning models algorithms analyze large datasets extract meaningful insights drive business decisions collaborate cr
Data Scientist,data scientist productexperimentation remote day per month uxbridge car allowance bonus company working market leading telecommunications company established data science ai team bring product focused data scientist team looking candidate proven experience experimentation ab testing role work directly senior stakeholders within outside team design conduct experiments
Data Scientist,data scientist productcustomer remote day per month greater london offices cash allowance bonus company working market leading telecommunications company established data science ai team bring product focused data scientist team work new productservice offering looking candidate proven experience segmentation propensity audience targetting etc role work directly senior stakeholders w
Data Scientist,data scientist remote london company company leading online ticketing provider across europe north america partnered venues include historic theatres studio theatres cinemas conference spaces modern live music arenas looking add new data scientist team pricing experience role working closely within team understand troubleshoot maintain endtoend across price optimisation control best prac
Data Scientist,data scientist brighton hybrid days per week company working exciting new role leading ecommerce company company secondhand marketplace ecommerce platform users sell trade preloved items looking add new data scientist team experience pricing role working closely within team understand troubleshoot maintain endtoend across price optimisation control best practices suggest
Data Scientist,data scientist brand new role business come define data scientist role develop deploy maintain accurate forecasting models drive datadriven decision making stock demand planning portsmouth based manufacturing company global distribution role requires someone immerse business identifying suggesting new data sources innovative approaches enhance forecasting models strong technical expertise sql py
Data Scientist,bettingjobs working sports analytics company work clients igaming industry seeking hire data scientist based london role looking data scientist work betting prediction side business helping improve ability predict match outcomes role involves researching ways modelling approaches use predict football matches improved turning th
Data Scientist,role data scientist salary k k location days week central london office working boutique investment research firm dedicated providing indepth market analysis actionable insights clients specialize uncovering unique investment opportunities rigorous research datadriven strategies small dynamic team value innovation collaboration passion excellence seeking highly skilled motivat
Data Scientist,data scientist hybrid london company working cutting edge ai start working within legaltech sector looking transform complaints resolution processes regulated industries founded cambridge university vision building online legal system customer disputes looking highly motivated data scientist join growing team role develop enhance aidriven solutions consumer dispute resoluti
Data Scientist,data scientist bonus oxford days week company supporting bespoke games studio key senior games analyst hire within role analyse game performance performing deep dive analysis improve user experience role successful senior games analyst responsibilities include create sustain queries visualisations monitor key metrics games analyse game performance variability provide actionable insights decisio
Data Scientist,client looking expand data capabilities addition talented data scientist exciting opportunity work cuttingedge projects harness data drive impactful business decisions solve complex challenges successful candidate bring strong analytical skills handson experience machine learning statistical analysis data engineering help client enhance datadriven strategies insights key responsibilities build
Data Scientist,ai engineer opportunity generative ai machine learning manchester passionate pushing boundaries ai machine learning join innovative team delivering cuttingedge solutions global clients looking experienced ai engineer work impactful projects leveraging generative ai advanced machine learning models databricks youll develop generative ai models like gpt dalle stable diffusion realworld applications bu
Data Scientist,role sits within econometrics team help business measure effectiveness efficiency business strategies learnings applied help shape british gas hives overall marketing strategy youll responsible delivering accurate appropriate models interpret analysis create concise insightful recommendations role varied exposure across business involve working closely commercial finance marketing
Data Scientist,lead data scientist l senior level sfia salary kk dependent experience location coventryhybrid scrumconnect scrumconnect leading force technology consultancy proudly contributing uks significant citizenfacing public services awardwinning team made substantial impact delivering services past two years alone work reached million citizens also achieved considerable savings
Data Scientist,title senior data scientist salary k equity location london onsite tech stack python sql cloud aws gcp azure excited partner forwardthinking proptech startup heart london seeking talented data scientist years commercial experience fantastic opportunity contribute innovative projects data science ai machine learning drive strategic decisions insights interests click apply
Data Scientist,ickstart tech career refonte position ai data science devops cloud internship refonte refonte refonte ai global leader edtech recognized delivering advanced solutions artificial intelligence ai data science digital marketing uiux design web development app development mission centers innovation excellence empowering talent achieve impactful results across globe learn httpsrefontelearningcom lau
Database Engineer,join us database engineer barclays youll build maintain infrastructure platforms products support applications data systems using hardware software networks cloud computing platforms required aim ensuring infrastructure reliable scalable secure successful database engineer experience experience mongodb database administrator similar role focus setting managin
Database Engineer,join us database engineer barclays youll build maintain infrastructure platforms products support applications data systems using hardware software networks cloud computing platforms required aim ensuring infrastructure reliable scalable secure successful database engineer experience database administrator postgresql serving highest level technical escalation complex da
Database Engineer,join us database engineer barclays youll build maintain infrastructure platforms products support applications data systems using hardware software networks cloud computing platforms required aim ensuring infrastructure reliable scalable secure successful database engineer experience database administrator postgresql serving highest level technical escalation complex da
Database Engineer,database engineer postgresql sql expert market leading hedge fund compensation client looking add key member global db team help support administrate secure key databases across business involve working closely users parts business define resolve information flow content issues helping enable support transformation business requirements database solutions lo
Database Engineer,team responsibilities inside technology services omni customisation team data architecture management team oversees delivery global performance biggest automotive advertiser world key elements product accuracy reliability availability data analysts clients horizon looking expand capabilities build new products enable new opportunities clients role summary key role
Database Engineer,database research engineer european tech recruit working closely multinational tech telecommunications company based edinburgh looking number junior principal level database research engineers join team role work close collaboration academic research institutions focused projects within programming languages compilers knowledge graphs positioning navigation cloud systems infrastructure responsibilities
Database Engineer,job description purpose role build maintain infrastructure platforms products support applications data systems using hardware software networks cloud computing platforms required aim ensuring infrastructure reliable scalable secure ensure reliability availability scalability systems platforms technology application software engineering techniques automation best practices inciden
Database Engineer,job description purpose role design develop improve software utilising various engineering methodologies provides business platform technology capabilities customers colleagues accountabilities development delivery highquality software solutions using industry aligned programming languages frameworks tools ensuring code scalable maintainable optimized performance crossfunctional collaboration product managers
Database Engineer,job description database engineer responsible development delivery new systems automate streamline processes required different departments support internal department changes upgrades software platforms primary contact technical questions relating inhouse bespoke systems interfacing database support supporting budgeting financial planning processes finance department including loading refreshing data based
Database Engineer,department data services employment type permanent full time location north west uk hybrid workplace type hybrid compensation year roles hiring manager jed shaw view jeds profile key responsibilities skills knowledge expertise benefits cdl software uks biggest insurance retailers rely cdls trend setting solutions drive success growth ambition commitment produced track record delivering exactly result client
Database Engineer,starling uks first leading digital bank mission fix banking vision fast technology fair service honest values tap phone time giving customers new way spend save manage money taking better care planet seen us become multiaward winning bank employs across five offices london cardiff dublin southampton soon manchester journey started
Database Engineer,database engineer dba sme database experience within postgresql required leading hedge fund based london emphasis postgresql nosql sql server backup skillset production engineering environments essential skills years experience database engineering production dba role production environment experience specialist focus postgresql environment understanding db monitoring analysis disaster recovery performance tuning server exposure
Database Engineer,pdi technologies empower worlds leading convenience retail petroleum brands cuttingedge technology solutions drive growth operational efficiency connecting convenience across globe empower businesses increase productivity make informed decisions engage faster customers loyalty programs shopper insights unmatched realtime market intelligence via mobile applications gasbuddy global team commit
Database Engineer,qube research technologies qrt global quantitative systematic investment manager operating liquid asset classes across world technology data driven group implementing scientific approach investing combining data research technology trading expertise shaped qrts collaborative mindset enables us solve complex challenges qrts culture innovation continuously drives ambition deliver high quality returns inv
Database Engineer,looking data reliability engineer join rapidly growing dbre team amazing opportunity join fast growing company make immediate real impact future product highscale high throughput environment systems running hundreds thousands queries per second grows time role responsible reliability databases making sure run smoothly providing required performance sca
