Category,Description
Data Scientist,job title web span classhighlightdeveloperspan freelance company flippd location remote uk preferred flippd flippd missiondriven startup building dual marketplace makes access dyslexia diagnoses simpler accessible goal empower individuals streamlining process connecting right specialists approximately platform already span classhighlightdevelopedspan looking skilled span classhighlightdeveloperspan complete project help bring vision life role seeking experienced web span classhighlightdeveloperspan finalise span classhighlightdevelopmentspan web app complete existing features implement missing components optimise platform launch ensure robust security measures place protect user data opportunity contribute meaningful project join impactful startup exciting stage growth key details compensation flat fee equity opportunity potential equity company based projects outcome potential become flippds cto commitment freelance projectbased youll complete span classhighlightdevelopmentspan dual marketplace platform ensure app fully functional responsive userfriendly collaborate team deliver key project goals implement robust security measures protect user data ensure privacy address bugs performance issues optimise platform scalability prepare app successful secure launch looking proven experience web span classhighlightdevelopmentspan eg html css javascript typescript backend frameworks familiarity building deploying marketplace platforms similar applications strong understanding web security best practices including safeguarding sensitive user information attention detail problemsolving skills ability work independently deliver results within agreed timelines passion working projects make realworld impact preferred skills experience tools frameworks relevant tech stack eg react nodejs etc background ai knowledge user authentication secure payment integrations responsive design join us contribute missiondriven project simplifies access dyslexia diagnoses gain opportunity earn equity growing startup work meaningful platform security usability functionality paramount help us make difference showcasing expertise
Data Scientist,hello search span classhighlightdataspan analyst research historical fundamental span classhighlightdataspan price span classhighlightdataspan target find best performing strategies terms sharpe ratios dataset around stocks yearly span classhighlightdataspan till excel see attached image example around variables per stock like eps dps price revenue etc also create many ratios like pe div etc look people help us make simple stock screeners work yearly basis x per year screener update please let know could help us also might permanent tasks experience please let us thanks ronald
Data Scientist,proposal please include similar projects worked looking ai developer help build ai tool analyses social media span classhighlightdataspan posts x using x api need scrape span classhighlightdataspan currently collect relevant social media posts mongodb database app look confluence across multiple posts detect trending topics discard junk identify important information automatically post insights xtwitter via api want build vector database setup integrations mongodb vector db twitter guide training ai setup filters example posts x likes frequency posting exclude posts x days old etc
Data Scientist,need indian agencies freelancer site requirement monthly retainer seeking highly skilled span classhighlightdataspan science developer expertise elastic search kibana logstash join team ideal candidate years professional experience play crucial role deploying resources government project role requires ability work independently secure internetrestricted environment onsite specific durations key responsibilities develop implement optimize span classhighlightdataspan science models solutions configure maintain elastic search clusters ensuring high availability performance design build visualization dashboards using kibana work logstash span classhighlightdataspan collection transformation ingestion analyse interpret large datasets derive actionable insights ensure security integrity span classhighlightdataspan compliance government regulations collaborate stakeholders understand project requirements deliver robust solutions travel government facility day onsite work period projects commencement required thereafter requirements years professional experience span classhighlightdataspan science elastic search kibana logstash strong understanding span classhighlightdataspan analysis modelling visualization techniques proven ability work independently restricted environment without internet access excellent problemsolving skills attention detail strong communication teamwork skills flexibility travel government facility needed initial day onsite requirement government facility remote work allowed postonboarding periodic onsite visits required
Data Scientist,interested deploying ai agent answer questions based giving agent multiple textbooks read would reproducible create multiple agents multiple different topics based different textbooks topics would also integrated x social media make occasional posts date topics regarding topic agents expertise answer questions posed
Data Scientist,building predictive databases using watson knowledge studio wks watson discovery involves integrating machine learning techniques natural language processing nlp extract analyze predict insights span classhighlightdataspan detailed stepbystep plan define project scope identify objectives define purpose predictive database eg predicting market trends detecting customer sentiment identifying risks span classhighlightdataspan sources determine span classhighlightdataspan sources structured semistructured unstructured examples social media span classhighlightdataspan customer reviews transaction records research documents span classhighlightdataspan preparation span classhighlightdataspan collection gather span classhighlightdataspan identified sources ensure diverse comprehensive datasets relevant predictive goals span classhighlightdataspan cleaning handle missing span classhighlightdataspan remove duplicates standardize formats annotation labeling use watson knowledge studio wks label annotate unstructured text define entity types eg person organization location relationships based project requirements model training watson knowledge studio create workspace set new wks project define annotation guidelines annotate text manually annotate representative sample span classhighlightdataspan train model use collaborative tools wks team annotations conflict resolution train custom nlp models train models entity extraction relation extraction classification using annotated datasets evaluate model performance using metrics like precision recall f score export models export trained model deployment watson discovery integrate watson discovery set discovery instance configure watson discovery environment ibm cloud upload datasets collections enhance wks models integrate custom models wks watson discovery enrich content analysis train relevancy models train watson discovery prioritize results based user queries use natural language queries validate refine relevancy build predictive database define predictive framework identify predictors eg keywords trends patterns outcomes eg actions insights span classhighlightdataspan indexing use watson discovery index span classhighlightdataspan faster retrieval analysis set queries create specific queries predict outcomes based historical patterns current span classhighlightdataspan integrate external models use external machine learning libraries watson machine learning add predictive models feed prediction results back database deployment automation create apis use watson discoverys apis allow realtime querying integration systems automate updates set pipelines update database new span classhighlightdataspan retrain models periodically user access develop dashboards applications endusers interact predictive database monitoring optimization track performance monitor system accuracy relevancy predictions iterative improvement continuously refine models new span classhighlightdataspan feedback users scalability scale system handle larger datasets complex queries use case scenarios market analysis predict sales trends based customer reviews social media sentiment healthcare insights analyze patient records predict health risks treatment outcomes legal risk assessment extract key entities contracts predict potential compliance risks tools resources watson knowledge studio custom nlp model creation watson discovery content enrichment search watson machine learning advanced prediction algorithms ibm cloud scalable hosting deployment span classhighlightdataspan annotation teams highquality labeled span classhighlightdataspan structured approach ensures predictive database robust scalable tailored specific needs project done phases subject successful completion milestones bonus considered subject approval company successful application subject approval house span classhighlightscientistsspan project also opportunity right candidate work long term basis subject quality work approval company management lastly job post customized objective objective create specific database use ibm watson create predictive model based specifications retain right customize job deliverables payment job subjected following milestones building scope defining project deliverables model training raw span classhighlightdataspan integrating ibm watson knowledge studio ibm discovery building predictive analysis model deployment case specific examples phase completed successfully prior payment next phase compensation project proof concept subject successful completion job early termination party unsuccessful project deliverables result loss compensation right full refund accepting offer offerree agrees keep work confidential work belong company paid work project paid installments intallment paid upon successful completion deliverable deliverables equal payments
Data Scientist,need someone deploy projects show ai impacts businesses task research find open source code online artificial intelligence projects deploy projects server prefer open code apps
Data Scientist,looking team individual experts develop mvp minimum viable product predictive analytics platform generates monthly forecasts financial markets confidential project requiring selected candidates sign nda details disclosed project involves building robust backend span classhighlightdataspan ingestion developing forecasting algorithms creating userfriendly dashboard display predictions insights system must modular scalable allow future enhancements integrations groundup development project seeking talented professionals experienced predictive analytics financial span classhighlightdataspan processing web application development project overview mvp include span classhighlightdataspan aggregation collect process historical realtime financial span classhighlightdataspan apis store span classhighlightdataspan structured secure database modeling analysis forecasting module develop algorithms predict financial trends generate monthly projections implement confidence scoring system indicate reliability forecasts dashboard create intuitive webbased interface users view forecasts insights display span classhighlightdataspan using interactive charts visualizations contextual insights integrate relevant market events span classhighlightdataspan trends enhance forecasting output roles responsibilities span classhighlightdataspan span classhighlightscientistspanmachine learning engineer design train forecasting models based financial span classhighlightdataspan implement confidence scoring predictions skills python tensorflowpytorch timeseries forecasting feature engineering backend developer build secure apis span classhighlightdataspan ingestion model integration set cloudbased infrastructure span classhighlightdataspan storage processing skills pythonnodejs awsgcp restful apis sqlnosql databases frontend developer design responsive webbased dashboard display forecasts insights integrate backend apis dynamic span classhighlightdataspan presentation skills reactjsvuejs htmlcss javascript chartjsdjs optional project manager recommended larger teams oversee project timelines deliverables team coordination tools jira trello slack key deliverables span classhighlightdataspan pipeline apis database secure span classhighlightdataspan ingestion processing forecasting engine functional model generating monthly financial projections confidence scores frontend dashboard userfriendly interface interactive span classhighlightdataspan visualization documentation comprehensive guides setup usage future development required experience proven expertise predictive analytics financial span classhighlightdataspan platforms familiarity financial apis large datasets ability work nda maintain confidentiality strong communication skills collaborative mindset project timeline estimated duration weeks start date preferred date deliverables deadline preferred deadline budget estimated total budget depending experience scope open hiring individuals team preferred experience past work predictive analytics financial modeling projects familiarity integrating thirdparty apis span classhighlightdataspan ingestion experience building dashboards interactive visualizations apply please include following application overview experience analytics financial platforms examples past projects portfolios generalized nda availability estimated timeline completing project hourly rate fixed price deliverables applying team specify roles covered team member individual rates
Data Scientist,looking freelancer perform span classhighlightdataspan analysis historical span classhighlightdataspan using machine learning grid search
Data Scientist,looking hire aiml span classhighlightdataspan specialist help us enhance expand existing dataset enterpriselevel communication span classhighlightdataspan current dataset includes tasks slack messages emails calendar events related project management collaboration task improve realism variety dataset adjusting task descriptions comments emails reflect dynamic authentic content eliminate duplicates repetitive content across platforms eg asana slack emails add context make span classhighlightdataspan diverse expand dataset adding new tasks emails slack messages calendar events ensuring align realworld enterprise operations experience working nlp span classhighlightdataspan augmentation creating synthetic datasets mimic realworld scenarios especially context enterprise collaboration tools
Data Scientist,company kloud httpswwwkloudnyc location bangalore experience years mode hybrid days work office week job summary seeking highly skilled span classhighlightdataspan engineering technical architect deep expertise google cloud platform gcp apache spark sap shana span classhighlightdataspan ingestion architect design implement scalable highperformance span classhighlightdataspan lake solutions ideal candidate extensive experience building span classhighlightdataspan ingestion pipelines managing big span classhighlightdataspan processing using apache spark integrating sap shana gcp cloud infrastructure key requirements years professional experience span classhighlightdataspan engineering specializing implementing largescale enterprise span classhighlightdataspan engineering projects latest technologies years handson experience gcp technologies years lead experience design implement endtoend span classhighlightdataspan architectures leveraging gcp services eg big query cloud storage dataflow pubsub cloud composer largescale span classhighlightdataspan ingestion processing build optimize largescale span classhighlightdataspan pipelines using apache spark gcp via dataproc spark services ensure high performance scalability sparkbased span classhighlightdataspan processing workloads lead integration sap shana span classhighlightdataspan gcp realtime batch span classhighlightdataspan processing manage span classhighlightdataspan extraction transformation loading etl processes sap shana cloud storage span classhighlightdataspan lakes develop manage scalable span classhighlightdataspan ingestion pipelines structured unstructured span classhighlightdataspan using tools like cloud dataflow cloud pubsub apache spark provide architectural guidance designing secure scalable efficient span classhighlightdataspan solutions google cloud platform integrating onpremisecloud systems like sap shana implement realtime streaming batch processing pipelines using apache spark dataflow gcp services meet business requirements implement span classhighlightdataspan governance access controls security best practices ensure integrity confidentiality compliance span classhighlightdataspan across systems collaborate business stakeholders span classhighlightdataspan span classhighlightscientistsspan engineering teams define span classhighlightdataspan requirements ensuring architecture aligns business goals optimize apache spark jobs performance scalability costefficiency ensuring architecture handle growing span classhighlightdataspan volumes provide technical leadership span classhighlightdataspan engineering team mentoring junior engineers span classhighlightdataspan architecture apache spark development gcp best practices technical expertise expertlevel programming proficiency python java scala extensive handson experience big span classhighlightdataspan technologies including spark hadoop hive yarn mapreduce pig kafka pyspark proficient google cloud platform services bigquery dataflow cloud storage dataproc cloud composer google pubsub google cloud functions expertise apache spark batch realtime processing well proficiency apache beam hadoop big span classhighlightdataspan frameworks experienced using cloud sql bigquery looker studio google span classhighlightdataspan studio cloudbased span classhighlightdataspan solutions skilled orchestration deployment tools like cloud composer airflow jenkins continuous integration deployment cicd expertise designing developing integration solutions involving hadoophdfs realtime systems span classhighlightdataspan warehouses analytics solutions experience devops practices including version control git cicd pipelines infrastructureascode eg terraform cloud deployment manager strong background working relational databases nosql databases inmemory databases experience managing large datasets within span classhighlightdataspan lake span classhighlightdataspan fabric architectures strong knowledge security best practices iam encryption mechanisms compliance frameworks gdpr hipaa within gcp environments experience implementing span classhighlightdataspan governance span classhighlightdataspan lineage span classhighlightdataspan quality frameworks indepth knowledge web technologies application programming languages oltpolap technologies span classhighlightdataspan strategy disciplines relational databases span classhighlightdataspan warehouse development big span classhighlightdataspan solutions led endtoend processes design development deployment maintenance span classhighlightdataspan engineering projects excellent debugging problemsolving skills retail ecommerce domain knowledge plus positive attitude strong analytical skills ability guide teams effectively preferred qualifications gcp certifications professional span classhighlightdataspan engineer professional cloud architect apache spark python certifications experience span classhighlightdataspan visualization tools like tableau power bi etc
Data Scientist,first task built app using flask vuejs mysql works beautifully computer need someone help deploy aws span classhighlightdatabasespan already set rds frontend set backend go eb ec discuss first task relatively easy someone lots aws experience second task want automate data scraping span classhighlightdatabasespan already scraping scripts working may need slight modifications needs set lambda also rds span classhighlightdatabasespan needs periodically updated new data
Data Scientist,job title l aws cloud span classhighlightdatabasespan support job location mumbai vikhroli job type onsite months job summary seeking experienced l aws cloud span classhighlightdatabasespan support span classhighlightengineerspan join team role provide advanced technical support aws cloud infrastructure span classhighlightdatabasespan systems ensuring high availability scalability performance cloudbased solutions responsible troubleshooting diagnosing resolving complex issues related aws services span classhighlightdatabasesspan integrations collaborating crossfunctional teams ensuring customers cloud environments running smoothly key responsibilities provide thirdlevel technical support aws cloud services span classhighlightdatabasespan technologies troubleshoot resolve complex issues related aws infrastructure services ec rds lambda etc span classhighlightdatabasespan solutions postgresql manage monitor optimize cloudbased span classhighlightdatabasesspan ensuring optimal performance security availability work closely customers diagnose issues provide root cause analysis implement solutions collaborate devops span classhighlightengineeringspan teams ensure seamless cloud deployments integrations lead participate incident management service restoration processes provide guidance support l l support teams document incidents service requests solutions ticketing system perform regular health checks audits aws cloud environments span classhighlightdatabasespan systems stay updated latest aws features services best practices assist design implementation scalable secure highly available cloud architectures
Data Scientist,project description seeking skilled software span classhighlightengineerspan implement new feature cvat allows designating annotation tasks training test mode feature provide different permissions annotators regarding access quality analytics ground truth data enabling effective training evaluation annotators problem currently cvat lacks mechanism differentiate annotation tasks used training purposes used testing annotator performance desired solution require solution modifies cvat allow designating tasks training test following functionalities task mode selection new option added task creation page allowing task creator select task mode either training test selection implemented checkbox dropdown menu annotator permissions training mode default setting annotators assigned training task permission view individual quality analytics score view conflicts annotations ground truth permissions functionalities annotator remain standard cvat workflow test mode annotators assigned test task permission view individual quality analytics score view conflicts annotations ground truth ground truth visibility ground truth data task completely hidden annotators test mode ground truth data visible task creator supervisor training test modes skills required proficiency python django cvat backend experience postgresql span classhighlightdatabasespan frontend development skills react good understanding rest apis experience git version control deliverables modified cvat codebase implemented solution clear documentation changes made
Data Scientist,wants centralize data multiple sources including pointofsale pos systems online transactions inventory span classhighlightdatabasesspan customer feedback platforms goal build etl pipeline integrates transforms loads data cloudbased data warehouse centralized system enable us perform realtime analytics sales trends inventory levels customer satisfaction
Data Scientist,experience andor certification azure data span classhighlightengineerspan azure developer azure devops span classhighlightengineerspan professional level nice etl data warehousing reporting experience experience coding azure context experience azure data factory experience azure data bricks experience azure devops pythonsql experience experience unittest pytest cicd experience
